{
  "slug": "demo",
  "productName": "Demo Suite",
  "productShortName": "Demo",
  "companyLegalName": "Demo Software Ltd",
  "crmProductName": "Demo CRM",
  "mailProductName": "Demo Mail",
  "baseDomain": "demo.example",
  "legacyDomains": [],
  "websiteUrl": "https://demo.example",
  "logoLight": null,
  "logoDark": null,
  "logoMark": null,
  "favicon": null,
  "colors": {
    "primary": "#0f766e",
    "primaryFg": "#ffffff",
    "accent": "#f59e0b",
    "sidebar": null,
    "surface": null
  },
  "themeDefault": "system",
  "fontFamily": null,
  "customCss": null,
  "supportEmail": "support@demo.example",
  "supportUrl": null,
  "docsUrl": null,
  "termsUrl": null,
  "privacyUrl": null,
  "hidePoweredBy": true,
  "tagline": null,
  "adminDomain": "admin.demo.example",
  "defaultDbUser": "demo",
  "defaultBackendPath": "/var/www/html/demo-backend",
  "pagesProjectCrm": "demo-crm",
  "pagesProjectStorefront": "demo-storefront"
}
