{
  "slug": "napnix",
  "productName": "Napnix Admin",
  "productShortName": "Napnix",
  "companyLegalName": "Napnix Pvt. Ltd.",
  "crmProductName": "NapCRM",
  "mailProductName": "NapMail",
  "baseDomain": "napnix.in",
  "websiteUrl": "https://napnix.in",
  "logoLight": null,
  "logoDark": null,
  "logoMark": null,
  "favicon": "/favicon.svg",
  "colors": {
    "primary": "#6366f1",
    "primaryFg": "#ffffff",
    "accent": "#d946ef",
    "sidebar": null,
    "surface": null,
    "brandScale": {
      "50": "#f0f3ff",
      "100": "#e0e7ff",
      "200": "#c7d2fe",
      "300": "#a5b4fc",
      "400": "#818cf8",
      "500": "#6366f1",
      "600": "#4f46e5",
      "700": "#4338ca",
      "800": "#3730a3",
      "900": "#312e81",
      "950": "#1e1b4b"
    },
    "accentScale": {
      "50": "#fdf4ff",
      "100": "#fae8ff",
      "200": "#f5d0fe",
      "300": "#f0abfc",
      "400": "#e879f9",
      "500": "#d946ef",
      "600": "#c026d3",
      "700": "#a21caf",
      "800": "#86198f",
      "900": "#701a75",
      "950": "#4a044e"
    }
  },
  "themeDefault": "system",
  "fontFamily": null,
  "customCss": null,
  "supportEmail": "support@napnix.in",
  "supportUrl": null,
  "docsUrl": null,
  "termsUrl": null,
  "privacyUrl": null,
  "hidePoweredBy": false,
  "adminDomain": "admin.napnix.in",
  "defaultDbUser": "nexcrm",
  "defaultBackendPath": "/var/www/html/nexcrm-backend"
}
